{
  "profile_id": "aibom-fairness-healthcare-triage-v0",
  "profile_version": "0.1.0",
  "bom_ref": "generic-healthcare-triage-mlbom-v0",
  "system_name": "Healthcare Triage Model",
  "system_domain": "clinical_triage",
  "generated_at": "2026-05-23T00:00:00Z",
  "fairmind_context": {
    "platform_name": "FairMind",
    "generation_mode": "synthetic_fixture",
    "source_services": [
      {
        "path": "apps/backend/src/application/services/ai_bom_service.py",
        "role": "AIBOM component lineage and risk/compliance status"
      },
      {
        "path": "apps/backend/src/application/services/real_ai_bom_service.py",
        "role": "Database-backed AIBOM document and component persistence"
      },
      {
        "path": "apps/backend/src/application/services/comprehensive_bias_detection_service.py",
        "role": "Dataset and model fairness metric evidence"
      },
      {
        "path": "apps/backend/src/application/services/monitoring_service.py",
        "role": "Post-deployment monitoring and drift evidence"
      },
      {
        "path": "apps/backend/src/application/services/automated_evidence_collector.py",
        "role": "Evidence categories for monitoring, documentation, and audit logging"
      }
    ],
    "evidence_boundary": "Synthetic FairMind fixture derived from FairMind service capabilities; not a production runtime export."
  },
  "components": [
    {
      "component_id": "health.dataset.encounters",
      "component_type": "dataset",
      "component_name": "Synthetic Triage Encounter Dataset",
      "version": "2026.05.synthetic",
      "upstream_components": [],
      "downstream_components": [
        "health.preprocessing.features"
      ],
      "protected_attributes_tested": [
        "gender",
        "age",
        "region",
        "language"
      ],
      "subgroup_coverage": {
        "evaluated_groups": [
          "gender:female",
          "gender:male",
          "age:under_30",
          "age:30_to_55",
          "age:over_55",
          "region:urban",
          "language:english"
        ],
        "missing_groups": [
          "region:rural",
          "language:non_english",
          "socioeconomic_proxy"
        ],
        "coverage_notes": "Synthetic encounters underrepresent rural and non-English patients."
      },
      "fairness_metrics": [
        {
          "metric": "dataset_representation_gap",
          "value": 0.22,
          "threshold": 0.1,
          "affected_groups": [
            "region:rural",
            "language:non_english"
          ],
          "evidence_state": "simulated"
        }
      ],
      "bias_tests_run": [
        {
          "test_name": "Synthetic encounter coverage scan",
          "test_type": "coverage",
          "result": "rural and non-English groups underrepresented",
          "evidence_state": "simulated",
          "evidence_ref": "health-evidence-coverage-001"
        }
      ],
      "known_bias_risks": [
        {
          "risk_id": "health-risk-001",
          "description": "Underrepresented groups may receive less reliable triage scores.",
          "affected_groups": [
            "region:rural",
            "language:non_english"
          ],
          "severity": "high",
          "evidence_state": "simulated"
        }
      ],
      "remediation_history": [],
      "validation_state": "simulated",
      "evidence_refs": [
        "health-evidence-coverage-001"
      ],
      "evidence_freshness": {
        "last_updated": "2026-05-09T00:00:00Z",
        "expires_at": "2026-08-09T00:00:00Z",
        "staleness_rule": "Dataset coverage evidence expires after 90 days or population refresh.",
        "evidence_state": "simulated"
      },
      "review_status": "review_required",
      "regulatory_mapping": [
        {
          "framework": "NIST AI RMF",
          "control": "Map 2.2",
          "claim": "Impacted groups are identified and represented in evidence.",
          "evidence_state": "simulated"
        }
      ],
      "unknowns": [
        "Socioeconomic proxy coverage is not measured."
      ],
      "risk_summary": {
        "overall_severity": "high",
        "key_risks": [
          "underrepresented groups"
        ],
        "unknown_count": 1,
        "stale_evidence_count": 0,
        "simulated_evidence_count": 2,
        "reviewer_action": "Request coverage evidence for rural, non-English, and socioeconomic proxy groups."
      },
      "claim_support": {
        "claim_id": "health.dataset.encounters.claim.reviewability",
        "claim_text": "Fairness evidence for Synthetic Triage Encounter Dataset is reviewable within the FairMind AIBOM fairness evidence profile.",
        "support_status": "partially_supported",
        "supporting_evidence_refs": [
          "health-evidence-coverage-001"
        ],
        "unsupported_reason": "Socioeconomic proxy coverage is not measured."
      },
      "evidence_gap_type": [
        "missing_subgroup_coverage",
        "proxy_risk_not_surfaced"
      ],
      "evidence_state_reason": "Evidence is synthetic fixture evidence, not a production runtime validation. Component validation_state is simulated; freshness evidence_state is simulated. Recorded evidence gaps: missing_subgroup_coverage, proxy_risk_not_surfaced.",
      "component_fault_localization": {
        "fault_component_id": "health.dataset.encounters",
        "upstream_faults": [],
        "downstream_claims_affected": [
          "health.preprocessing.features.claim.reviewability",
          "NIST AI RMF Map 2.2"
        ],
        "localization_confidence": "medium"
      },
      "reviewer_required_action": "request_more_evidence"
    },
    {
      "component_id": "health.preprocessing.features",
      "component_type": "preprocessing",
      "component_name": "Triage Feature Normalization Pipeline",
      "version": "2.0.1",
      "upstream_components": [
        "health.dataset.encounters"
      ],
      "downstream_components": [
        "health.model.triage"
      ],
      "protected_attributes_tested": [
        "gender",
        "age",
        "region",
        "language"
      ],
      "subgroup_coverage": {
        "evaluated_groups": [
          "gender:female",
          "gender:male",
          "age:under_30",
          "age:30_to_55",
          "age:over_55",
          "region:urban"
        ],
        "missing_groups": [
          "region:rural",
          "language:non_english",
          "socioeconomic_proxy"
        ],
        "coverage_notes": "Missingness imputation may interact with region and language access patterns."
      },
      "fairness_metrics": [
        {
          "metric": "missingness_gap",
          "value": 0.19,
          "threshold": 0.1,
          "affected_groups": [
            "region:rural"
          ],
          "evidence_state": "simulated"
        }
      ],
      "bias_tests_run": [
        {
          "test_name": "Missingness disparity scan",
          "test_type": "data_quality_bias_test",
          "result": "rural encounter features have higher missingness",
          "evidence_state": "simulated",
          "evidence_ref": "health-evidence-preprocess-001"
        }
      ],
      "known_bias_risks": [
        {
          "risk_id": "health-risk-002",
          "description": "Imputation may reduce reliability for rural patients.",
          "affected_groups": [
            "region:rural"
          ],
          "severity": "medium",
          "evidence_state": "simulated"
        }
      ],
      "remediation_history": [],
      "validation_state": "simulated",
      "evidence_refs": [
        "health-evidence-preprocess-001"
      ],
      "evidence_freshness": {
        "last_updated": "2026-05-09T00:00:00Z",
        "expires_at": "2026-08-09T00:00:00Z",
        "staleness_rule": "Feature-bias evidence expires after pipeline changes.",
        "evidence_state": "simulated"
      },
      "review_status": "review_required",
      "regulatory_mapping": [
        {
          "framework": "ISO/IEC 42001",
          "control": "Data quality management",
          "claim": "Input quality limitations are documented.",
          "evidence_state": "simulated"
        }
      ],
      "unknowns": [
        "No post-imputation subgroup calibration evidence is attached."
      ],
      "risk_summary": {
        "overall_severity": "medium",
        "key_risks": [
          "feature missingness disparity"
        ],
        "unknown_count": 1,
        "stale_evidence_count": 0,
        "simulated_evidence_count": 2,
        "reviewer_action": "Request post-imputation subgroup performance evidence."
      },
      "claim_support": {
        "claim_id": "health.preprocessing.features.claim.reviewability",
        "claim_text": "Fairness evidence for Triage Feature Normalization Pipeline is reviewable within the FairMind AIBOM fairness evidence profile.",
        "support_status": "partially_supported",
        "supporting_evidence_refs": [
          "health-evidence-preprocess-001"
        ],
        "unsupported_reason": "No post-imputation subgroup calibration evidence is attached."
      },
      "evidence_gap_type": [
        "missing_subgroup_coverage"
      ],
      "evidence_state_reason": "Evidence is synthetic fixture evidence, not a production runtime validation. Component validation_state is simulated; freshness evidence_state is simulated. Recorded evidence gaps: missing_subgroup_coverage.",
      "component_fault_localization": {
        "fault_component_id": "health.preprocessing.features",
        "upstream_faults": [
          "health.dataset.encounters"
        ],
        "downstream_claims_affected": [
          "health.model.triage.claim.reviewability",
          "ISO/IEC 42001 Data quality management"
        ],
        "localization_confidence": "medium"
      },
      "reviewer_required_action": "request_more_evidence"
    },
    {
      "component_id": "health.model.triage",